{
  "schema_version": "1.0",
  "kind": "wawalu.integration.query-sample",
  "export_id": "40000000-0000-4000-8000-000000000003",
  "snapshot": { "source_instance_id": "psn_gateway_demo_000001", "sequence": 6, "generated_at": "2026-07-24T12:00:00Z", "bucket_granularity": "day", "completeness": "complete", "omitted_record_count": 0, "issues": [] },
  "privacy": { "classification_site": "browser-tab", "prompt_text_retained": false, "direct_identifiers_included": false },
  "records": [
    { "org_unit_id": "psn_unit_demo_00000002", "query_date": "2026-07-23", "model_raw": "acme-sonnet-1", "input_tokens": 700, "output_tokens": 400, "category": "overProvisioned" }
  ]
}
